{
  "$schema": "https://json-schema.org/draft/2020-12/schema",
  "$id": "https://hivemind.local/tasks/schema.json",
  "title": "Task",
  "description": "A single unit of work for the agentic team. Field names mirror Jira issue fields so the same task can later be created in Jira without lossy translation.",
  "type": "object",
  "required": ["key", "title", "description", "acceptance_criteria", "status", "priority", "created_at", "updated_at"],
  "additionalProperties": false,
  "properties": {
    "key": {
      "type": "string",
      "pattern": "^TASK-[0-9]{3,}$",
      "description": "Stable human-readable identifier. Maps to Jira issue key on migration."
    },
    "title": {
      "type": "string",
      "minLength": 1,
      "maxLength": 200,
      "description": "One-line summary. Maps to Jira `summary`."
    },
    "description": {
      "type": "string",
      "description": "Markdown-formatted full description of the work. Maps to Jira `description`."
    },
    "acceptance_criteria": {
      "type": "array",
      "minItems": 1,
      "items": {
        "type": "string",
        "pattern": "\\S",
        "description": "TASK-189 — must contain at least one non-whitespace character. Rejects empty strings and whitespace-only strings (mechanically detectable vacuity). Deliberately does NOT attempt to detect unfalsifiable-but-well-formed prose (e.g. 'It works correctly.') — see TASK-189's hand-off for why that judgement is left to review, not the schema."
      },
      "description": "Falsifiable criteria for 'done'. Criteria are verified according to the ticket's verification_tier: regression locks for tests-after, recorded UAT for uat-only."
    },
    "verification_tier": {
      "type": "string",
      "enum": ["tdd", "tests-after", "uat-only"],
      "description": "Governs how the ticket is verified. Absent means tests-after (backward-compatible default). tests-after = implement then add minimal regression locks; uat-only = no new specs, verified via conversational UAT. \"tdd\" (tests-first, single-commit discipline) is WRITE-FROZEN: TASK-212 (2026-08-13 human decision) retired it and it can no longer be ASSIGNED to a ticket — that policy is enforced one layer up, by the two write surfaces (src/task-store.js's VERIFICATION_TIERS, src/mcp-server.js's zod VERIFICATION_TIER), not by this storage schema. This schema keeps accepting \"tdd\" only so the ~101 tickets (100 done + any still in-flight) that legitimately carry it as a historical record of how they were verified stay writable at all — appending a comment or transitioning status on one of them re-validates the WHOLE stored object against this enum, and a schema that rejected \"tdd\" would make that historical record permanently un-rewritable, which is not what 'kept as a historical record' (CLAUDE.md's Testing section) means. Never assign \"tdd\" to a new ticket — createTask and the MCP create_task tool reject it independently of this schema."
    },
    "requires_uat": {
      "type": "boolean",
      "description": "TASK-221 — answers a question distinct from verification_tier: do this ticket's acceptance criteria describe something a person can observe (as opposed to how much test rigor the ticket needs). Assigned at Workflow step 1, same moment as verification_tier. true = the acceptance criteria describe human-observable behavior and a UAT script must be run before close; false = they do not. DEFAULT WHEN ABSENT: false — an explicit human decision (2026-09-09, TASK-221), not an inference: the ~206 tickets already closed before this field existed carry no requires_uat at all, and a true default would retroactively brand all of them non-compliant, which is precisely the mass-retrofit TASK-223 freezes as a baseline instead of migrating. Read this default from exactly one place: src/task-store.js's requiresUat(task) helper — TASK-220 (reviewer sensor gating) and TASK-222 (close-guard enforcement) both call it rather than re-deriving `=== true` independently.",
      "default": false
    },
    "marker": {
      "type": "string",
      "enum": ["[EXPLICIT]", "[INFERRED:strong]", "[INFERRED:weak]", "[INFERRED]", "[ASSUMED]", "[MISSING_INFO]"],
      "description": "Epistemic calibration of the ticket's load-bearing claims (Spine). Optional; ACs may also carry inline markers, which the reviewer validates. Must respect source_tier's ceiling (T3/T4 cannot be [EXPLICIT])."
    },
    "source_tier": {
      "type": "string",
      "enum": ["T1", "T2", "T3", "T4", "TX"],
      "description": "Authority of the evidence behind the ticket's claims. Caps how strong marker may be: [EXPLICIT] requires T1/T2; T4 is orientation-only; TX is rejected. See .knowledge/meta/SOURCE_TIERS.md."
    },
    "confidence": {
      "type": "object",
      "additionalProperties": false,
      "description": "Decomposed confidence (components, NOT a scalar), populated from the brain's confidence model. Each component is in [0,1].",
      "properties": {
        "source_credibility": { "type": "number", "minimum": 0, "maximum": 1 },
        "assertion_strength": { "type": "number", "minimum": 0, "maximum": 1 },
        "corroboration": { "type": "number", "minimum": 0, "maximum": 1 },
        "verification_status": { "type": "number", "minimum": 0, "maximum": 1 }
      }
    },
    "status": {
      "type": "string",
      "enum": ["todo", "in_progress", "in_review", "blocked", "done"],
      "description": "Lifecycle state. Maps to Jira workflow status."
    },
    "priority": {
      "type": "string",
      "enum": ["low", "medium", "high", "critical"]
    },
    "labels": {
      "type": "array",
      "items": { "type": "string" },
      "default": []
    },
    "assignee": {
      "type": ["string", "null"],
      "description": "Subagent name or human identifier. Null = unassigned.",
      "default": null
    },
    "depends_on": {
      "type": "array",
      "items": { "type": "string", "pattern": "^TASK-[0-9]{3,}$" },
      "default": [],
      "description": "Other task keys that must reach `done` before this one can start."
    },
    "linked_commits": {
      "type": "array",
      "items": { "type": "string" },
      "default": [],
      "description": "Commit SHAs the Developer/orchestrator attributes to this ticket. src/task-store.js validates each entry's SHAPE only (/^[0-9a-f]{7,40}$/i, TASK-082) — it does NOT verify the sha resolves to a real commit (TASK-188 AC6: closeTask is a pure state-store function with no git dependency, deliberately). src/mcp-server.js's close_task tool runs a best-effort, advisory-only existence check (git cat-file, never blocking the close) and reports the result as linked_commits_verification in its response, distinguishing 'verified present/missing' from 'could not verify' (no git binary, or repoRoot is not a git work tree) rather than implying every recorded sha is trustworthy."
    },
    "linked_prs": {
      "type": "array",
      "items": { "type": "string" },
      "default": []
    },
    "comments": {
      "type": "array",
      "default": [],
      "items": {
        "type": "object",
        "required": ["author", "at", "body"],
        "additionalProperties": false,
        "properties": {
          "author": {
            "type": "string",
            "enum": ["orchestrator", "developer", "reviewer", "researcher", "uat", "backlog-seeder"],
            "description": "TASK-188 — constrained to the roles the system actually writes today (derived from the live tasks/ corpus plus src/backlog-seeder.js). This is a known-set check only, NOT proof of identity: every write flows through the same MCP surface regardless of author, so the primitive cannot verify WHO is calling. src/task-store.js additionally rejects 'reviewer' as close_task's own directly-supplied closing-comment author (see closeTask's ClosingCommentAuthorError) — a review's legitimacy is defined by being recorded as a separate, pre-existing comment, not fabricated as the terminal closing remark."
          },
          "at": { "type": "string", "format": "date-time" },
          "body": { "type": "string" }
        }
      }
    },
    "created_at": { "type": "string", "format": "date-time" },
    "updated_at": { "type": "string", "format": "date-time" },
    "jira_key": {
      "type": ["string", "null"],
      "default": null,
      "description": "Populated when the task has been mirrored to Jira. Until then, null."
    }
  },
  "allOf": [
    {
      "$comment": "TASK-189 AC2 — calibration-laundering guard, expressed as a real cross-field rule rather than prose: marker '[EXPLICIT]' requires source_tier 'T1' or 'T2' (mirrors .knowledge/meta/SOURCE_TIERS.md's marker-ceiling table). Only fires when BOTH fields are present — a ticket carrying marker:'[EXPLICIT]' with no source_tier at all is unaffected (backward-compatible; source_tier stays optional). Deliberately narrower than the full T1-T4 ceiling table (e.g. does not enforce [INFERRED:strong] requiring T2+, or T4's 'orientation only' constraint on weaker markers) — see TASK-189's hand-off for the scoping rationale.",
      "if": {
        "required": ["marker", "source_tier"],
        "properties": { "marker": { "const": "[EXPLICIT]" } }
      },
      "then": {
        "properties": { "source_tier": { "enum": ["T1", "T2"] } }
      }
    }
  ]
}
